[
  { "id": "mother_skarrow", "name": "Mother Skarrow", "cr": "1", "xp": 200, "level": 2, "castingStat": "wis",
    "scores": { "str": 7, "dex": 12, "con": 12, "int": 13, "wis": 16, "cha": 12 }, "hp": 44, "ac": 13, "armor": "Light",
    "weapon": { "id": "quarterstaff", "damage": "1d6", "damageType": "bludgeoning", "stat": "str", "finesse": false, "ranged": false,
                "range": 1, "reach": false, "tags": ["simple", "versatile"] },
    "saves": ["wis", "cha"], "abilities": ["goblin_shaman.cinder_bolt", "mother_skarrow.grandmothers_hex", "goblin_boss.rally"],
    "passives": [], "skills": ["insight", "perception"], "tags": ["goblinoid", "humanoid", "caster", "leader", "boss"],
    "aiProfile": "boss", "sprite": "characters.goblin_shaman",
    "phases": [ { "hpBelow": 50, "abilities": ["mother_skarrow.old_song"], "passives": [] } ] },
  { "id": "vorga", "name": "Vorga", "cr": "1", "xp": 200, "level": 2,
    "scores": { "str": 10, "dex": 15, "con": 14, "int": 10, "wis": 14, "cha": 10 }, "hp": { "byLevel": { "1": 21, "5": 240 } }, "ac": 17, "armor": "Medium",
    "weapon": { "id": "scimitar", "damage": "2d8", "damageType": "slashing", "stat": "dex", "finesse": true, "ranged": false,
                "range": 1, "reach": false, "tags": ["martial", "light"] },
    "attacks": 3, "saves": ["con", "wis"], "abilities": ["goblin.nimble_escape", "goblin_boss.rally"], "passives": [], "skills": ["stealth"],
    "tags": ["goblinoid", "humanoid", "leader"], "aiProfile": "boss", "sprite": "characters.goblin_spear",
    "phases": [ { "hpBelow": 50, "abilities": ["goblin_boss.warcry"], "passives": [], "aiProfile": "boss_cruel" } ] },
  { "id": "ivo_rime", "name": "Ivo Rime", "cr": "6", "xp": 2300, "level": 7, "castingStat": "int",
    "scores": { "str": 9, "dex": 14, "con": 14, "int": 19, "wis": 13, "cha": 11 }, "hp": 140, "ac": 15, "armor": "Light",
    "weapon": { "id": "staff", "damage": "1d6", "damageType": "bludgeoning", "stat": "str", "finesse": false, "ranged": false,
                "range": 1, "reach": false, "tags": ["simple"] },
    "saves": ["int", "wis"], "abilities": ["necromancer.shadow_bolt", "ivo_rime.rime_grasp"], "passives": [],
    "resist": ["cold", "necrotic"], "skills": ["arcana", "medicine"], "tags": ["humanoid", "caster", "boss"],
    "aiProfile": "caster", "sprite": "characters.necromancer",
    "phases": [ { "hpBelow": 50, "abilities": ["necromancer.grave_chill"], "passives": [] } ] },
  { "id": "halvard", "name": "Ser Halvard", "cr": "8", "xp": 3900, "level": 9, "attacks": 3,
    "scores": { "str": 20, "dex": 12, "con": 18, "int": 12, "wis": 14, "cha": 16 }, "hp": 280, "ac": 19, "armor": "Heavy",
    "weapon": { "id": "greatsword", "damage": "2d8", "damageType": "slashing", "stat": "str", "finesse": false, "ranged": false,
                "range": 1, "reach": false, "tags": ["martial", "two_handed"] },
    "saves": ["str", "con", "wis", "cha"], "abilities": ["black_knight.dread_cleave", "halvard.wardens_judgement"], "passives": [],
    "resist": ["necrotic"], "immune": ["poison"], "skills": ["athletics", "history"], "tags": ["undead", "humanoid", "warden", "boss"],
    "aiProfile": "boss", "sprite": "characters.black_knight",
    "phases": [ { "hpBelow": 50, "abilities": ["black_knight.unholy_ward"], "passives": [] } ] },
  { "id": "maren_sorrel", "name": "Maren Sorrel", "cr": "9", "xp": 5000, "level": 10, "castingStat": "cha",
    "scores": { "str": 10, "dex": 14, "con": 16, "int": 15, "wis": 16, "cha": 20 }, "hp": 105, "ac": 16, "armor": "Medium",
    "weapon": { "id": "flame_staff", "damage": "1d8", "damageType": "fire", "stat": "cha", "finesse": false, "ranged": false,
                "range": 1, "reach": false, "tags": ["simple"] },
    "saves": ["con", "wis", "cha"], "abilities": ["maren_sorrel.ember_lance", "maren_sorrel.hearthfire"], "passives": [],
    "resist": ["fire"], "skills": ["persuasion", "religion", "insight"], "tags": ["humanoid", "cultist", "caster", "leader", "boss"],
    "aiProfile": "boss", "sprite": "characters.cult_leader",
    "phases": [ { "hpBelow": 50, "abilities": ["cult_leader.fanatic_zeal"], "passives": [] } ] }
]
