[
  {
    "id": "hound",
    "name": "Hunting Hound",
    "cr": "1/2",
    "xp": 0,
    "level": 1,
    "scores": { "str": 14, "dex": 14, "con": 12, "int": 4, "wis": 14, "cha": 8 },
    "hp": { "1": 16, "6": 26, "10": 38 },
    "ac": 14,
    "armor": "None",
    "move": 5,
    "jump": 2,
    "initiativeBonus": 0,
    "saves": ["str", "dex"],
    "skills": ["perception", "stealth"],
    "resources": {},
    "abilities": [],
    "passives": ["wolf.knockdown"],
    "weapon": {
      "id": "bite",
      "damage": "1d8",
      "damageType": "piercing",
      "stat": "str",
      "finesse": true,
      "ranged": false,
      "range": 1,
      "reach": false,
      "tags": ["natural"]
    },
    "attacks": 1,
    "resist": [],
    "immune": [],
    "vulnerable": [],
    "tags": ["beast", "companion"],
    "sprite": "bosses.hound.tan",
    "aiProfile": "companion",
    "phases": []
  },
  {
    "id": "sapling",
    "name": "Grove Sapling",
    "cr": "1/2",
    "xp": 0,
    "level": 1,
    "scores": { "str": 14, "dex": 10, "con": 14, "int": 6, "wis": 14, "cha": 8 },
    "hp": { "1": 18, "6": 30, "10": 44 },
    "ac": 14,
    "armor": "None",
    "move": 4,
    "jump": 2,
    "initiativeBonus": 0,
    "saves": ["con", "wis"],
    "skills": ["perception"],
    "resources": {},
    "abilities": [],
    "passives": [],
    "weapon": {
      "id": "vine_lash",
      "damage": "1d8",
      "damageType": "bludgeoning",
      "stat": "str",
      "finesse": false,
      "ranged": false,
      "range": 2,
      "reach": true,
      "tags": ["natural", "reach"]
    },
    "attacks": 1,
    "resist": ["bludgeoning", "piercing"],
    "immune": [],
    "vulnerable": ["fire"],
    "tags": ["plant", "companion"],
    "sprite": "bosses.sapling.spring",
    "aiProfile": "companion",
    "phases": []
  },
  {
    "id": "imp",
    "name": "Bound Imp",
    "cr": "1/2",
    "xp": 0,
    "level": 1,
    "scores": { "str": 8, "dex": 16, "con": 12, "int": 11, "wis": 12, "cha": 14 },
    "hp": { "1": 14, "6": 24, "10": 34 },
    "ac": 13,
    "armor": "None",
    "move": 5,
    "jump": 4,
    "initiativeBonus": 2,
    "saves": ["dex", "cha"],
    "skills": ["stealth", "perception"],
    "resources": {},
    "abilities": [],
    "passives": [],
    "weapon": {
      "id": "hellfire_bolt",
      "damage": "1d8",
      "damageType": "fire",
      "stat": "dex",
      "finesse": true,
      "ranged": true,
      "range": 5,
      "reach": false,
      "tags": ["natural", "ranged"]
    },
    "attacks": 1,
    "resist": ["fire", "poison"],
    "immune": [],
    "vulnerable": [],
    "tags": ["fiend", "companion"],
    "sprite": "bosses.imp.crimson",
    "aiProfile": "companion",
    "phases": []
  }
]
