[
  { "id": "mimic", "name": "Mimic", "cr": "2", "xp": 450, "level": 3, "move": 3,
    "scores": { "str": 17, "dex": 12, "con": 15, "int": 5, "wis": 13, "cha": 8 }, "hp": 40, "ac": 14,
    "weapon": { "id": "bite", "damage": "1d8", "damageType": "piercing", "stat": "str", "finesse": false, "ranged": false,
                "range": 1, "reach": false, "tags": ["natural"] },
    "abilities": ["mimic.adhesive_bite"], "passives": [], "immune": ["acid"], "skills": ["stealth"],
    "tags": ["aberration"], "aiProfile": "brute", "sprite": "bosses.mimic.oak" },
  { "id": "troll", "name": "Troll", "cr": "5", "xp": 1800, "level": 5, "move": 4, "attacks": 2,
    "scores": { "str": 18, "dex": 13, "con": 20, "int": 7, "wis": 9, "cha": 7 }, "hp": 72, "ac": 15,
    "weapon": { "id": "claws", "damage": "2d6", "damageType": "slashing", "stat": "str", "finesse": false, "ranged": false,
                "range": 1, "reach": false, "tags": ["natural"] },
    "saves": ["str", "con"], "abilities": ["troll.boulder_toss"], "passives": [], "vulnerable": ["acid", "fire"],
    "skills": ["perception"], "tags": ["giant", "boss"], "aiProfile": "boss", "sprite": "bosses.troll.troll",
    "phases": [ { "hpBelow": 50, "abilities": ["troll.frenzy_roar"], "passives": [] } ] },
  { "id": "golem", "name": "Stone Golem", "cr": "6", "xp": 2300, "level": 7, "move": 3, "attacks": 2,
    "scores": { "str": 20, "dex": 9, "con": 20, "int": 3, "wis": 11, "cha": 1 }, "hp": 95, "ac": 17,
    "weapon": { "id": "slam", "damage": "2d8", "damageType": "bludgeoning", "stat": "str", "finesse": false, "ranged": false,
                "range": 1, "reach": false, "tags": ["natural"] },
    "saves": ["str", "con"], "abilities": ["golem.seismic_slam"], "passives": [],
    "resist": ["piercing", "slashing"], "immune": ["poison", "psychic"], "tags": ["construct", "boss"],
    "aiProfile": "boss", "sprite": "bosses.golem.granite",
    "phases": [ { "hpBelow": 50, "abilities": ["golem.stone_aegis"], "passives": [] } ] },
  { "id": "fire_elemental", "name": "Fire Elemental", "cr": "5", "xp": 1800, "level": 6, "move": 5, "attacks": 2,
    "scores": { "str": 10, "dex": 17, "con": 16, "int": 6, "wis": 10, "cha": 7 }, "hp": 68, "ac": 15,
    "weapon": { "id": "flame_touch", "damage": "2d6", "damageType": "fire", "stat": "dex", "finesse": true, "ranged": false,
                "range": 1, "reach": false, "tags": ["natural"] },
    "saves": ["dex", "con"], "abilities": ["fire_elemental.flame_surge"], "passives": [],
    "immune": ["fire", "poison"], "vulnerable": ["cold"], "tags": ["elemental", "fire", "boss"],
    "aiProfile": "boss", "sprite": "bosses.fire_elemental.ember",
    "phases": [ { "hpBelow": 50, "abilities": ["drake.flame_breath"], "passives": [] } ] },
  { "id": "water_elemental", "name": "Water Elemental", "cr": "5", "xp": 1800, "level": 6, "move": 5, "attacks": 2,
    "scores": { "str": 18, "dex": 14, "con": 18, "int": 5, "wis": 10, "cha": 8 }, "hp": 74, "ac": 15,
    "weapon": { "id": "wave_slam", "damage": "2d6", "damageType": "bludgeoning", "stat": "str", "finesse": false, "ranged": false,
                "range": 1, "reach": false, "tags": ["natural"] },
    "saves": ["str", "con"], "abilities": ["water_elemental.tidal_crush"], "passives": [],
    "resist": ["acid", "fire"], "immune": ["poison"], "tags": ["elemental", "water", "boss"],
    "aiProfile": "boss", "sprite": "bosses.water_elemental.sea",
    "phases": [ { "hpBelow": 50, "abilities": ["water_elemental.undertow"], "passives": [] } ] },
  { "id": "earth_elemental", "name": "Earth Elemental", "cr": "5", "xp": 1800, "level": 6, "move": 4, "attacks": 2,
    "scores": { "str": 20, "dex": 8, "con": 20, "int": 5, "wis": 10, "cha": 5 }, "hp": 84, "ac": 17,
    "weapon": { "id": "stone_fist", "damage": "2d8", "damageType": "bludgeoning", "stat": "str", "finesse": false, "ranged": false,
                "range": 1, "reach": false, "tags": ["natural"] },
    "saves": ["str", "con"], "abilities": ["earth_elemental.tremor"], "passives": [],
    "resist": ["piercing", "slashing"], "immune": ["poison"], "vulnerable": ["thunder"],
    "tags": ["elemental", "earth", "boss"], "aiProfile": "boss", "sprite": "bosses.earth_elemental.stone",
    "phases": [ { "hpBelow": 50, "abilities": ["golem.stone_aegis"], "passives": [] } ] },
  { "id": "air_elemental", "name": "Air Elemental", "cr": "5", "xp": 1800, "level": 6, "move": 6, "jump": 4, "attacks": 2,
    "scores": { "str": 14, "dex": 20, "con": 14, "int": 6, "wis": 10, "cha": 6 }, "hp": 64, "ac": 16,
    "weapon": { "id": "gale_strike", "damage": "2d6", "damageType": "thunder", "stat": "dex", "finesse": true, "ranged": false,
                "range": 1, "reach": false, "tags": ["natural"] },
    "saves": ["dex", "wis"], "abilities": ["air_elemental.whirlwind"], "passives": [],
    "resist": ["lightning", "thunder"], "immune": ["poison"], "tags": ["elemental", "air", "boss"],
    "aiProfile": "boss", "sprite": "bosses.air_elemental.gale",
    "phases": [ { "hpBelow": 50, "abilities": ["air_elemental.gale_blast"], "passives": [] } ] },
  { "id": "dragon", "name": "Red Dragon", "cr": "10", "xp": 5900, "level": 10, "move": 5, "jump": 4, "attacks": 2,
    "scores": { "str": 23, "dex": 12, "con": 21, "int": 14, "wis": 13, "cha": 19 }, "hp": 160, "ac": 18,
    "weapon": { "id": "dragon_jaws", "damage": "2d10", "damageType": "piercing", "stat": "str", "finesse": false, "ranged": false,
                "range": 2, "reach": true, "tags": ["natural", "reach"] },
    "saves": ["dex", "con", "wis", "cha"], "abilities": ["dragon.fire_breath", "dragon.frightful_roar"], "passives": [],
    "immune": ["fire"], "skills": ["perception", "stealth"], "tags": ["dragon", "boss", "huge"],
    "aiProfile": "boss_cruel", "sprite": "bosses.dragon.red",
    "phases": [ { "hpBelow": 50, "abilities": ["dragon.cataclysm"], "passives": [], "aiProfile": "boss_cruel" } ] }
]
