[
  { "id": "giant_spider", "name": "Giant Spider", "cr": "1", "xp": 200, "jump": 4,
    "scores": { "str": 14, "dex": 16, "con": 12, "int": 2, "wis": 11, "cha": 4 }, "hp": 26, "ac": 14,
    "weapon": { "id": "bite", "damage": "1d8", "damageType": "piercing", "stat": "dex", "finesse": true, "ranged": false,
                "range": 1, "reach": false, "tags": ["natural"] },
    "abilities": ["spider.web"], "passives": ["spider.venom"], "skills": ["stealth"], "tags": ["beast"],
    "aiProfile": "skirmisher", "sprite": "beasts.spider.black" },
  { "id": "kobold", "name": "Kobold", "cr": "1/8", "xp": 25,
    "scores": { "str": 7, "dex": 15, "con": 9, "int": 8, "wis": 7, "cha": 8 }, "hp": 7, "ac": 14, "armor": "Light",
    "weapon": { "id": "dagger", "damage": "1d4", "damageType": "piercing", "stat": "dex", "finesse": true, "ranged": false,
                "range": 1, "reach": false, "tags": ["simple", "light"] },
    "abilities": [], "passives": [], "tags": ["humanoid", "kobold"],
    "aiProfile": "coward", "sprite": "characters.kobold" }
]
