[
  { "id": "bandit", "name": "Bandit", "cr": "1/2", "xp": 100, "level": 2,
    "scores": { "str": 12, "dex": 16, "con": 12, "int": 10, "wis": 10, "cha": 10 }, "hp": 26, "ac": 13, "armor": "Light",
    "weapon": { "id": "handaxe", "damage": "1d12", "damageType": "slashing", "stat": "dex", "finesse": true, "ranged": false,
                "range": 1, "reach": false, "tags": ["simple", "light"] },
    "abilities": ["bandit.dirty_strike"], "passives": [], "skills": ["stealth"], "tags": ["humanoid", "bandit"],
    "aiProfile": "skirmisher", "sprite": "characters.bandit" },
  { "id": "bandit_captain", "name": "Bandit Captain", "cr": "2", "xp": 450, "level": 3, "attacks": 2,
    "scores": { "str": 17, "dex": 16, "con": 14, "int": 12, "wis": 11, "cha": 14 }, "hp": 64, "ac": 15, "armor": "Medium",
    "weapon": { "id": "greatsword", "damage": "2d6", "damageType": "slashing", "stat": "str", "finesse": false, "ranged": false,
                "range": 1, "reach": false, "tags": ["martial", "two_handed"] },
    "saves": ["str", "dex", "wis"], "abilities": ["bandit_captain.rally_cry"], "passives": [],
    "skills": ["athletics", "deception"], "tags": ["humanoid", "bandit", "leader", "boss"],
    "aiProfile": "boss", "sprite": "characters.bandit_captain",
    "phases": [ { "hpBelow": 50, "abilities": ["bandit.dirty_strike"], "passives": [] } ] },
  { "id": "cultist", "name": "Cultist", "cr": "1/2", "xp": 100, "level": 2, "castingStat": "cha",
    "scores": { "str": 10, "dex": 13, "con": 12, "int": 11, "wis": 12, "cha": 14 }, "hp": 16, "ac": 13, "armor": "Light",
    "weapon": { "id": "ritual_dagger", "damage": "1d4", "damageType": "piercing", "stat": "dex", "finesse": true, "ranged": false,
                "range": 1, "reach": false, "tags": ["simple", "light"] },
    "saves": ["wis"], "abilities": ["cultist.dark_bolt"], "passives": [], "skills": ["deception", "religion"],
    "tags": ["humanoid", "cultist", "caster"], "aiProfile": "caster", "sprite": "characters.cultist" },
  { "id": "cult_leader", "name": "Ember Hierophant", "cr": "4", "xp": 1100, "level": 5, "castingStat": "cha",
    "scores": { "str": 11, "dex": 14, "con": 14, "int": 13, "wis": 15, "cha": 18 }, "hp": 58, "ac": 16, "armor": "Medium",
    "weapon": { "id": "flame_staff", "damage": "1d8", "damageType": "fire", "stat": "cha", "finesse": false, "ranged": false,
                "range": 1, "reach": false, "tags": ["simple"] },
    "saves": ["wis", "cha"], "abilities": ["cultist.dark_bolt", "cult_leader.hellfire_burst"], "passives": [],
    "resist": ["fire"], "skills": ["persuasion", "religion"], "tags": ["humanoid", "cultist", "leader", "boss"],
    "aiProfile": "boss", "sprite": "characters.cult_leader",
    "phases": [ { "hpBelow": 50, "abilities": ["cult_leader.fanatic_zeal"], "passives": [] } ] },
  { "id": "dark_elf", "name": "Drow Blade", "cr": "2", "xp": 450, "level": 4, "move": 5, "attacks": 2,
    "scores": { "str": 11, "dex": 18, "con": 12, "int": 13, "wis": 12, "cha": 13 }, "hp": 34, "ac": 16, "armor": "Light",
    "weapon": { "id": "rapier", "damage": "1d8", "damageType": "piercing", "stat": "dex", "finesse": true, "ranged": false,
                "range": 1, "reach": false, "tags": ["martial", "finesse"] },
    "saves": ["dex", "wis"], "abilities": ["dark_elf.shadow_step"], "passives": ["spider.venom"],
    "skills": ["perception", "stealth"], "tags": ["humanoid", "elf"],
    "aiProfile": "skirmisher", "sprite": "characters.dark_elf" },
  { "id": "black_knight", "name": "Black Knight", "cr": "5", "xp": 1800, "level": 6, "attacks": 2,
    "scores": { "str": 18, "dex": 12, "con": 16, "int": 11, "wis": 13, "cha": 15 }, "hp": 76, "ac": 18, "armor": "Heavy",
    "weapon": { "id": "greatsword", "damage": "2d6", "damageType": "slashing", "stat": "str", "finesse": false, "ranged": false,
                "range": 1, "reach": false, "tags": ["martial", "two_handed"] },
    "saves": ["str", "con", "wis"], "abilities": ["black_knight.dread_cleave"], "passives": [],
    "resist": ["necrotic"], "skills": ["athletics", "intimidation"], "tags": ["humanoid", "boss"],
    "aiProfile": "boss", "sprite": "characters.black_knight",
    "phases": [ { "hpBelow": 50, "abilities": ["black_knight.unholy_ward"], "passives": [], "aiProfile": "boss_cruel" } ] }
]
